<?xml version="1.0" encoding="utf-8"?>
 <Lista xmlns:xsi="http://www.w3.org/2001/XMLSchema-instance" 
xsi:noNamespaceSchemaLocation="curso.xsd">
	<Curso>
		<Titulo>Lenguaje de Marcas</Titulo>
		<Horas>200</Horas>
		<alumno>
			<nombre>Pepe</nombre>
			<apellidos>Perez</apellidos>
		</alumno>
		<profesor>
			<nombre>Ana</nombre>
			<apellidos>Lopez</apellidos>
			<modulo>LM</modulo>
		</profesor>
		<bedel>
			<nombre>Jose</nombre>
			<apellidos>Gomez</apellidos>
			<turno>Ma√±anas</turno>
		</bedel>
		<director antiguedad="4">
			<nombre>Jose</nombre>
			<apellidos>Gomez</apellidos>
		</director>
	</Curso>
	<Curso>
		<Titulo>BBDD</Titulo>
		<Horas>210</Horas>
		<alumno>
			<nombre>Pepe</nombre>
			<apellidos>Perez</apellidos>
		</alumno>
		<profesor>
			<nombre>Ana</nombre>
			<apellidos>Lopez</apellidos>
			<modulo>LM</modulo>
		</profesor>
	</Curso>
 </Lista>

